id,authors,title,abstract
P1062,Fabian Froehlich: NYU,Can't touch this? Why vibrotactile feedback matters in educational VR  ,This study investigates the relationship between vibrotactile feedback and sense of presence in VR. The inquiry focuses on corrective and reenforcing feedback in STEM learning outcomes using a VR environment called [blinded].  In a randomized within-subject design experiment (N=68) participants got assigned to a vibrotactile and non-vibrotactile condition. Our hypotheses: Participants in the vibrotactile-condition report higher sense of presence ratings compared to the non-haptic condition. Results indicate that vibrotactile feedback increases the sense of presence and impacts metacognition. Participants who received corrective feedback as a vibrotactile stimuli are more likely to underestimate their actual test performance.
P1063,Yang Zhan: Waseda University; Yiming Sun: Waseda University; Tatsuo Nakajima: Waseda University,Exploring the efficient and hedonic shopping: A Comparative Study of in-game VR Stores,"Shopping in Virtual Reality (VR) become popular in recent years since it provides immersive experiences. However, there is insufficient understanding of how efficient and hedonic features in VR stores affect the user experiences concurrently. This work aimed to address this gap by integrating a 2D user interface store and a 3D diegetic store into a VR game for comparative analysis. We explore the effects of efficient and hedonic factors on the users' perception and experiences. Results from a within-subject study ($N$=14) revealed that the diegetic store surpasses the 2D store in offering hedonic features, providing suggestions for VR store designs."
P1064,Xiaodan Hu: NAIST; Yan Zhang: Shanghai Jiao Tong University; Monica Perusquia-Hernandez: Nara Institute of Science and Technolgy; Yutaro Hirao: Nara Institute of Science and Technology; Hideaki Uchiyama: Nara Institute of Science and Technology; Kiyoshi Kiyokawa: Nara Institute of Science and Technology,Pinhole Occlusion: Enhancing Soft-edge Occlusion Using a Dynamic Pinhole Array,"Systems with occlusion capabilities have gained interest in augmented reality, vision augmentation, and image processing. To address the challenge of creating a precise yet lightweight occlusion system, we introduce a novel architecture to tackle occlusion blurriness due to defocusing.  Our approach, utilizing a dynamic pinhole array on a transmissive spatial light modulator positioned between the eye and the occlusion layer, offers adaptive pinhole patterns, gaze-contingent functionality, and the potential to reduce visual artifacts. Our preliminary result demonstrates that, with the focal plane at 1.8 m, an occlusion placed at 4 cm can be observed sharply through a 4.3 mm aperture."
P1065,Jindi Wang: Durham Univeristy; Ioannis Ivrissimtzis: Durham University; Zhaoxing Li: University of Southampton; Lei Shi: Newcastle University,Comparative Efficacy of 2D and 3D Virtual Reality Games in American Sign Language Learning,"Extensive research on sign language aimed to enhance communication between hearing individuals and the deaf community. With ongoing advancements in virtual reality and gamification, researchers are exploring their application in sign language learning. This study compares the impact of 2D and 3D games on American Sign Language (ASL) learning, using questionnaires to assess user experience. Results show that 3D games enhance engagement, attractiveness, usability, and efficiency, although user performance remains similar in both environments. The findings suggest the potential of 3D game-based approaches to improving ASL learning experiences while also identifying areas for enhancing dependability and clarity in 3D environments."
P1068,Katharina Margareta Theresa Pöhlmann: KITE-Toronto Rehabilitation Institute; Aalim Makani: Toronto Metropolitan University; Raheleh Saryazdi: Trent University; Keshavarz Behrang: The KITE Research Institute,Cybersickness Lies in the Eye of the Observer - Pupil Diameter as a Potential Indicator of Motion Sickness in Virtual Reality?,"Cybersickness is a widespread problem for many users of Virtual Reality systems. Changes in pupil diameter have been suggested as potential physiological correlates of cybersickness, but the relationship remains vague. Here, we further investigated how pupil diameter changes in relation to cybersickness by engaging participants in a passive locomotion through an outer-space environment. Participants who experienced sickness showed greater variance in pupil diameter compared to non-sick participants, whereas average pupil diameter did not differ. Our results suggest that irregular pupillary rhythms may be a potential correlate of cybersickness, which could be used to objectively identify cybersickness."
P1069,Chanwoo Lee: Imperial College London; Kyubeom Shim: Sogang University; Sanggyo Seo: Sogang Univ.; Gwonu Ryu: Dept. of Art & Technology; Yongsoon Choi: Sogang Univ.,Never Tell The Trick: Covert Interactive Mixed Reality System for Immersive Theatre,"This study explores the integration of Ultra-Wideband (UWB) technology into Mixed Reality (MR) Systems for immersive theatre. Addressing the limitations of existing technologies like Microsoft Kinect and HTC Vive, the research focuses on overcoming challenges in robustness to occlusion, tracking volume, and cost efficiency in props tracking. Utilizing the UWB, the immersive MR system enhances the scope of performance art by enabling larger tracking areas, more reliable and cheaper multi-prop tracking, and reducing occlusion issues. Preliminary user tests demonstrate meaningful improvements in immersive experience, promising a new possibility in Extended Reality (XR) theatre and performance art."
P1070,Junya Nakamura: Toyohashi University of Technology; Michiteru Kitazaki: Toyohashi University of Technology,Enhancing Virtual Walking in Lying Position: Upright Perception by Changing Self-Avatar's Posture,"We aimed to decrease visual-proprioceptive conflict in experiencing virtual walking with the lying posture. An optic flow during an avatar's standing up was presented before virtual walking that was induced by the radial optic flow and foot vibrations. The walking sensation and telepresence slightly increased by the standing-up optic flow, but it did not reach statistical significance. Participants felt as the posture was more matched to the walking avatar with the standing-up optic flow compared to the no-animation condition. These results highlight the potential for posture-informed VR design to improve user experiences in a situation with visual-proprioceptive conflict."
P1072,Daniele Giunchi: University College London; Riccardo Bovo: Imperial College London; Nels Numan: University College London; Anthony Steed: University College London,StreamSpace: A Framework for Window Streaming in Collaborative MR Environments,"We introduce StreamSpace as a framework for the exploration of screen-based collaborative MR experiences, focusing on the streaming, integration, and layout of screen content in MR environments. Utilizing Unity and Ubiq, this framework allows users to engage with, reposition, and resize uniquely identified screens within a user-centric virtual space. Building on Ubiq's WebRTC capabilities, our framework enables real-time streaming and transformations through peer-to-peer communication. Key features of StreamSpace include distributed streaming, automated screen layout, and flexible privacy settings for virtual screens. Introducing StreamSpace, we aim to provide a foundational basis for research on screen-based collaborative MR applications."
P1074,Gang Li: University of Glasgow; Ari Billig: SyncVR Medical; Chao Ping Chen: Shanghai Jiao Tong University; Katharina Margareta Theresa Pöhlmann: KITE Rehabilitation Institution,Can Brain Stimulation Reduce VR motion sickness in Healthy Young Adults During an Immersive Relaxation Application? A Study of tACS,"This study marks the first exploration of whether a non-invasive transcranial alternating current stimulation (tACS) on the left parietal cortex can reduce VR motion sickness (VRMS) induced by a commercial VR relaxation app. Two VRMS conditions were examined for 36 healthy young adults: 1) pure VRMS without a moving platform; 2) VRMS with a side-to-side rotary chair. Participants underwent three counterbalanced tACS protocols at the beta frequency band (sham, treatment, and control). Contrary to our hypothesis, the treatment protocol did not significantly reduce VRMS in either condition. Given the protocol's prior success in our previous tACS study, we discussed potential factors hindering the replication of our earlier achievement."
P1078,Hyemin Shin: Korea University; Hanseob Kim: Korea University; DongYun Joo: Korea University; Gerard Jounghyun Kim: Korea University,Super-Resolution AR?: Enhanced Image Visibility for AR Imagery?,"In AR applications, there may be situations in which the visual target is not clearly visible/legible because it is too far or small.  The unclear part of the imagery can be captured and magnified, but the image quality can still be problematic with the aliasing artifacts by the limited resolution.  This poster proposes to apply deep learning-based upscaling to enhance the low-resolution images. We developed a prototype system that can capture an image and upscale/present it to the user. The pilot study demonstrated that upscaled imagery improved image clarity, the ability to find hidden information more quickly, and user experience."
P1079,Yechan Yang: Korea University; Hanseob Kim: Korea University; Gerard Jounghyun Kim: Korea University,u-DFOV: User-Activated Dynamic Field of View Restriction for Managing Cybersickness and Task Performance,"Dynamic field of view restriction is one effective way of mitigating cybersickness by modulating the amount of visual information during virtual navigation. However, in the presence of an interactive task for which visibility is important, it can impede the task performance. This poster examined the efficiency of users, manually engaging the dynamic field of view restriction to control and mitigate cybersickness while performing interactive tasks. The comparative experiment has shown that the user-activated method significantly reduced cybersickness as much as the automatic method. However, it also achieved significantly higher task performance and usability despite the manual control."
P1080,Yechan Yang: Korea University; Hanseob Kim: Korea University; Jungha Kim: Korea University; Gerard Jounghyun Kim: Korea University,PianoFMS: Real-time Evaluation of Cybersickness by Keyboard Fingering,"Various measurement tools/methods have been developed to assess cybersickness induced in virtual environments, e.g., using the controller, dial device, and verbal input. In this poster, we propose PianoFMS as a cybersickness measurement tool that allows users to directly input absolute scores using the five piano keys without tampering with visual content. The preliminary study revealed that the levels of cybersickness measured using both the dial and PianoFMS were similar, and they each exhibited a significant correlation with that of the conventional post-experiment questionnaire scores. However, the PianoFMS exhibited a markedly enhanced level of usability in comparison to the dial."
P1082,Dario Gentile: Politecnico di Bari; Francesco Musolino: Polytechnic University of Bari; Michele Fiorentino: Polythecnic Institute of Bari; fabio vangi: Polytechnic University of Bari,VR Interface vs Desktop to convey Quality of Outerwear: a comparative study,"Conveying the quality of garments through media as in the physical store is demanding. This study proposes the design of a VR interface that aims to convey outerwear quality, featuring the 3D model animated through physical simulation. To measure the effectiveness of this interface, it is tested simultaneously with its corresponding desktop counterpart, with the photo gallery of the product, in a within-subject analysis on 50 users. Results show that perceived quality of products changes between the experiences. Moreover, in VR visual content was found to be more significant for the quality assessment than written information."
P1083,Nagisa Ito: The University of Tokyo; Hiroyuki Umemura: National Institute of Advanced Industrial Science and Technology; Kunihiro Ogata: National Institute of Advanced Industrial Science and Technology; Kenta Kimura: National Institute of Advanced Industrial Science and Technology,Development of Force Display Using Pneumatic Actuators for Efficient Conveyance of Emotion,"This study investigated the emotional impact of varying force in haptic feedback during gripping. Previous studies have not focused on how grip strength influences emotional expression, despite its known use in conveying feelings. We developed a haptic device to present grip-like haptic presentations and conducted an experiment (N=17) to evaluate the emotions elicited by different haptic presentations. The study found that force, speed, and presentation pattern influence both valence (positive or negative emotion) and arousal (intensity of emotion). The results also indicated that haptic feedback communicates not only anger and disgust but also happiness and surprise."
P1084,Junpei Sano: The University of Electro-Communications; Naoya Koizumi: Department of Informatics,Mid-air Imaging Based on Truncated Cylindrical Array Plate,"This paper presents a mid-air imaging optical system consisting of two dimensionally arranged truncated cylindrical optical elements. The proposed system aims to reduce the impact of stray light and improve the limited viewing range of mid-air images in micromirror array plates, an existing mid-air imaging optical system. In this study, we used ray tracing to assess mid-air images formed by our proposed optical system. The results show that our method is practical in terms of the invisibility of stray light and brightness of the image when viewed from an angle."
P1085,Amal Hashky: University of Florida; Benjamin Rheault: University of Florida; Ahmed Rageeb Ahsan: University of Florida ; Lauren Newman: University of Florida; Eric Ragan: University of Florida,Multitasking with Graphical Encoding Visualization of Numerical Values in Virtual Reality,"This study evaluates the influence of various visual representations of numerical values on users' ability to multitask in virtual reality. We designed a game-like VR simulation where users had to complete one main task while maintaining the status of other subtasks. Supplemental visualizations showed risk status of the subtask depending on experimental condition, with different visual data encodings: position, brightness, color, and area. We collected preliminary data (n=18) on participant performance during the experiment and subjective ratings afterward. The results showed that the intervention rate significantly differed between the four visual encodings, with the position-based version having the lowest rate."
P1086,Kaylee Andrews: Augusta University; Jeffrey L Benson Jr.: Augusta University; Jason Orlosky: Augusta University,Alleviating the Uncanny Valley Problem in Facial Model Mapping Using Direct Texture Transfer,"Though facial models for telepresence have made significant progress in recent years, most model reconstruction techniques still suffer from artifacts or deficiencies that result in the uncanny valley problem when used for real-time communication. In this paper, we propose an optimized approach that makes use of direct texture transfer and reduces the inconsistencies present in many facial modeling algorithms. By mapping the source texture from a 2D image to a rough 3D facial mesh, detailed features are preserved, while still allowing a 3D perspective view of the face. Moreover, we accomplish this in real time with a single, monocular camera."
P1092,Yi Wang: Beijing Jiaotong University; Ze Gao: Hong Kong University of Science and Technology,Embracing Tradition Through Technology: The Mixed Reality Calligraphy Studying Environment,"This article introduces an innovative Mixed Reality (MR) system designed explicitly for calligraphy learning and practice. Learners must prepare numerous copies of calligraphy works and character templates in traditional calligraphy study and practice. They often rely on oral guidance from teachers in person for their calligraphy practice. However, with the progress of digital technology, we envision leveraging MR wearable glasses combined with image capture and analysis techniques to assist calligraphy learners in improving their practice in a more flexible time."
P1094,Bettina Schlager: Columbia University; Steven Feiner: Columbia University,Designing Non-Humanoid Virtual Assistants for Task-Oriented AR Environments,"In task-oriented Augmented Reality (AR), humanoid Embodied Conversational Agents can enhance the feeling of social presence and reduce mental workload. Yet, such agents can also introduce social biases and lead to distractions. This presents a challenge for AR applications that require the user to concentrate mainly on a task environment. To address this, we introduce a non-humanoid virtual assistant designed for minimal visual intrusion in AR. Our approach aims to enhance a user's focus on the tasks they need to perform. We explain our design choices based on previously published guidelines and describe our prototype implemented for an optical--see-through headset."
P1097,Zhonghao Zhu: Beijing Institute of Technology; Weizhi Nai: Jilin University; Xin Wang: Jilin University; Yue Liu: Beijing Institute of Technology,A Virtual Reality Musical Instrument Integrated with a Remote Playing Robot System,"Music education and performance are often constrained by geographical limitations. To evaluate the effectiveness of remote music performance, we designed a virtual reality musical instrument system with a remote playing robot. The system comprises a virtual Irish tin whistle playing system and a remote playing robot system. In the virtual playing system, sensors capture the performer's gestures, translating them into corresponding tin whistle playing commands and producing the music. The playing robot is constructed with mechanical hands, and a data transmission module is programmed to facilitate communication between the virtual playing system and the robot, enabling remote simulated performances."
P1098,"Reidner Santos Cavalcante: Federal University of Uberlândia; Edgard Afonso Lamounier Jr.: Federal University of Uberlândia; Alcimar Soares: Faculty of Electrical Engineering, Federal University of Uberlândia; Aya Gaballa: Qatar University; John Cabibihan: Qatar University",Sensory Feedback in a Serious Gaming Environment and Virtual Reality for Training Upper Limb Amputees,"In this article, the authors present a system based on Immersive Virtual Reality and Serious Games for training the use of prostheses by upper limb amputees with a tactile feedback. By using EMG signal processing users can control the opening and closing of a virtual prosthesis, just like in real life. Tactile feedback causes an improvement in the sensation of touch. Tests were carried out with separate groups: with and without sensory feedback with amputated and non-amputee volunteers. Tests in which users who received haptic feedback demonstrated improvements in performance compared to those who did not use haptic feedback."
P1101,Germán Calcedo: University of Groningen; Ester Gonzalez-Sosa: Nokia; Diego González Morín: Nokia; Pablo Perez: Nokia; Alvaro Villegas: Nokia,Do You XaRaoke? Immersive Realistic Singing Experience \\ with Embodied Singer,"We have developed an immersive karaoke experience that allows users to sing their favorite songs in front of a simulated audience. The karaoke experience is designed within an immersive stadium scene with a simulated audience and stage lights that synchronize with the song's beats and displayed lyrics. Unlike VR-based karaoke commercial solutions, users can even see their real bodies as video-based self-avatars through the use of a deep learning network and a real microphone without using VR controllers. Preliminary results from a subset of 17 participants validate the developed prototype and provide insights for future improvements."
P1102,Md Jahirul Islam: Kennesaw State University; Rifatul Islam: Kennesaw State University,Towards Optimized Cybersickness Prediction for Computationally Constrained Standalone Virtual Reality Devices,"Cybersickness, affecting 60-95% of VR users, poses a challenge for immersive experiences.  Research using multimodal data, like pupilometry and heart rate, to predict cybersickness using complex machine-learning models often requires off-the-shelf computing resources (i.e., cloud servers), which is impractical for standalone VR devices (SVRs) as network lag and processing limitations can introduce latency during immersion, exacerbating cybersickness. We propose a novel approach that minimizes the computational cost of cybersickness prediction models by hyper-parameter tuning and reducing training parameters while maintaining prediction accuracy. Our method significantly improves training and inference time, paving the way for optimized prediction frameworks on resource-constrained SVRs."
P1103,Ziqi Wang: university of the arts london; Ze Gao: Hong Kong University of Science and Technology,Enhancing Body Ownership of Avian Avatars in Virtual Reality through Multimodal Haptic Feedback,"This paper uses multimodal haptic feedback to enhance users' body ownership in virtual reality through wearable devices. In this case, the human is transformed into a bird, which belongs to the beyond-real transformations category in virtual reality interactions. For body transformation, wearable retractable straps can help people mimic the movement mechanism of avian bodies; for space transformation, the inflatable cushions and blowers can simulate the air resistance and lift, oxygen deprivation, and temperature decrease during the take-off process of avian avatars. The system aims to establish a realistic fidelity of the haptic feedback to enhance the user's body ownership."
P1105,Aidan Morris: College of Holy Cross; Michael Vail: College of the Holy Cross; Gabriel Hanna: College of Holy Cross; Anurag Rimzhim: College of Holy Cross,Effect of Ambulatory Conditions and Virtual Locomotion Techniques on Distance Estimation and Motion Sickness of a Navigated VR Environment,"We present preliminary results from a 2 X 2 between-subjects experiment. Our two IVs were ambulatory-restrictive (i.e., without locomotion) postural conditions (sitting vs. standing), and virtual navigation technique of steering versus teleporting. Participants navigated a complex virtual environment comprising outdoor and indoor environments for 10 minutes. We found that teleporting may result in less online distance estimation error than steering. Motion sickness was lower while teleporting than steering and when sitting than standing. Teleporting also resulted in better system usability than steering. We discuss the results' implications for VR usability."
P1106,Layla Erb: Augusta University; Jason Orlosky: Augusta University,Tremor Stabilization for Sculpting Assistance in Virtual Reality,"This paper presents an exploration of assistive technology for virtual reality (VR) art, such as sculpting and ceramics. For many artists, tremors from Parkinsonian diseases can interfere with molding, carving, cutting, and modeling of different mediums for creating new sculptures.  To help address this, we have developed a system that algorithmically stabilizes tremors to enhance the artistic experience for creators with physical impairments or movement disorder. In addition, we present a real-time sculpting application that allows us to measure differences in sculpting actions and a target object or shape."
P1108,Hong Wang: University of South Florida; Tam Do: College of Engineering; Zhao Han: University of South Florida,Designing Indicators to Show a Robot's Physical Vision Capability,"In human-robot interaction (HRI), studies show humans can mistakenly assume that robots and humans have the same field of view, possessing an inaccurate mental model of a robot. This misperception is problematic during collaborative HRI tasks where robots might be asked to complete impossible tasks about out-of-view objects. In this initial work, we aim to align humans' mental models of robots by exploring the design of field-of-view indicators in augmented reality (AR). Specifically, we rendered nine such indicators from the head to the task space, and plan to register them onto the real robot and conduct human-subjects studies."
P1112,Brendan Kelley: Colorado State University; Christopher Wickens: Colorado State University; Benjamin A. Clegg: Colorado State University; Amelia C. Warden: Colorado State University; Francisco Raul Ortega: Colorado State University,Guiding Gaze: Comparing Cues for Visual Search,"Visual search tasks are commonplace in daily life. In cases where the time and accuracy of the search is critical (such as first responder, crisis, or military scenarios) augmented reality (AR) visual cueing is potentially beneficial. Three cue conditions (3D Arrow, 2D Wedge, and Gaze Lines) were tested in a visual search task against a baseline no cue condition. Results show that any cue is better than none, however the Gaze Line design produced the lowest search time and greatest accuracy."
