id,authors,title,abstract
P1113,Seitaro Inagaki: Nagoya Institute of Technology; Kenji Funahashi: Nagoya Institute of Technology,Eye direction control and reduction of discomfort by vection in HMD viewing of panoramic images,"We have previously proposed an “eye direction exaggeration method.” That facilitates rearward visibility by exaggerating the angle of the eye direction when viewing panoramic images with an HMD in a seated position. In this study, we improved this exaggeration method. However, the exaggeration sometimes increased discomfort such as VR sickness. We also tried to reduce discomfort by presenting horizontally moving particles and inducing vection stably."
P1114,Xiongju Sun: Xi'an Jiaotong-Liverpool University; Xiaoyi Xue: Xi'an Jiaotong-Liverpool University; Yangyang HE: Xi'an Jiaotong-Liverpool University; Jingjing Zhang: Xi'an Jiaotong-Liverpool University,Collaborative Motion Modes in Serious Game Using Virtual Co-embodiment: A Pilot Study on Usability and Agency,"With the increasing attention to collaboration in Serious Games, particularly in immersive virtual environments, a novel approach of virtual co-embodiment (e.g., one avatar controlled by multiple users) in recent studies has the potential to contribute to the research on collaborative motion in multiplayer games. This pilot study investigates the usability and the agency of collaborative motion modes in a virtual cycling game under the virtual co-embodiment system. Results showed that these new collaborative modes reported a higher perceived usability. Besides, based on quantitative and qualitative findings, co-embodiment modes in this virtual serious game might evoke an enhanced users' agency."
P1116,Elia Gatti: University College London; Daniele Giunchi: University College London; Nels Numan: University College London; Anthony Steed: University College London,AIsop: Exploring Immersive VR Storytelling Leveraging Generative AI,"We introduce AIsop, a system that autonomously generates VR storytelling experiences using generative artificial intelligence (AI). AIsop crafts unique stories by leveraging state-of-the-art Large Language Models (LLMs) and employs Text-To-Speech (TTS) technology for narration. Further enriching the experience, a visual representation of the narrative is produced through a pipeline that pairs LLM-generated prompts with diffusion models, rendering visuals for clusters of sentences in the story. Our evaluation encompasses two distinct use cases: the narration of pre-existing content and the generation of entirely new narratives. AIsop highlights the myriad research prospects spanning its technical architecture and user engagement."
P1117,"Masaru Tanaka: NHK Science & Technology Research Laboratories; Hiroyuki Kawakita: Japan Broadcasting Corporation; Takuya Handa: Science & Technology Research Laboratories, NHK",Development and Evaluation of an AR News Interface for Efﬁcient Information Access,"In this study, we developed a user interface (UI) for augmented reality (AR) glasses designed to allow users to browse news articles easily and efficiently. The UI uses natural language processing and dimensionality reduction techniques to place articles optimally within a virtual space. We compared this UI with two other AR-based interfaces in a user study with 13 participants, and the results show that the proposed interface reduced the time required to browse articles as well as the cognitive load of the activity."
P1119,Tania Kaimel: Graz University of Technology; Ana Stanescu: Graz University of Technology; Peter Mohr: Graz University of Technology; Dieter Schmalstieg: Graz University of Technology; Denis Kalkofen: Graz University of Technology,Progress Observation in Augmented Reality Assembly Tutorials Using Dynamic Hand Gesture Recognition,"We propose a proof-of-concept augmented reality assembly tutorial application that uses a video-see-through headset to guide the user through assembly instruction steps. It is solely controlled by observing the user's physical interactions with the workpiece. The tutorial progresses automatically, making use of hand gesture classification to estimate the progression to the next instruction. For dynamic hand gesture classification, we integrate a neural network module to classify the user's hand movement in real time. We evaluate the learned model used in our application to provide insights into the performance of implicit gestural interactions."
P1121,Matthias Wölwer: University of Trier; Benjamin Weyers: Trier University; Daniel Zielasko: University of Trier,How Long Do I Want to Fade Away? The Duration of Fade-To-Black Transitions in Target-Based Discontinuous Travel (Teleportation),"A fade-to-black animation enhances the transition during teleportation, yet its duration has not been systematically explored even though it is one of the central parameters. To fill this gap, we conducted a small study to determine a preferred duration. We find a short duration of 0.3s to be the average preference, contrasting durations used previously in the literature. This research contributes to the systematic parameterization of discontinuous travel."
P1122,Agapi Chrysanthakopoulou: University of Patras; Kostantinos Moustakas: University of Patras,Real-time shader-based shadow and occlusion rendering in AR,"We present novel methods designed to elevate the realism of augmented reality (AR) applications focusing specifically on optical see-through devices. Our work integrates shadow rendering methods for multiple light sources and dynamic occlusion culling techniques. By creating custom surface shaders we can manage multiple light sources in real-time, augmenting depth perception and spatial coherence. Furthermore, the dynamic occlusion culling system handles occluded objects, ensuring a more convincing and seamless user experience. Several cases and methods are presented with their results for various lighting and spatial conditions, promising a more enhanced and immersive user experience in various AR domains."
P1125,Michael Ramirez: Universidad Escuela Colombiana de Ingeniería Julio Garavito; Hamed Tadayyoni: Ontario Tech University; Heather McCracken: Ontario Tech University; Alvaro Quevedo: Ontario Tech University; Bernadette A. Murphy: Ontario Tech University,Identifying Markers of Immersion Using Auditory Event-Related EEG Potentials in Virtual Reality with a Novel Protocol for Manipulating Task Difficulty ,"Immersion is defined as the degree in which the senses are engaged with the virtual environment. Recent studies have focused on investigating the role of difficulty (challenge immersion) through correlating auditory event-related potentials (ERPs) to task difficulty. This study introduces a novel experimental protocol for studying immersion in which other confounding variables than difficulty are equalized by choosing a VR jigsaw puzzle as the task in which the difficulty is only adjusted by the number of pieces. By introducing two new metrics in conformity with the metrics from literature, this work shows promise for auditory ERPs as markers of immersion."
P1316,Daniel Neves Coelho: Curvature Games; Eike Langbehn: University of Applied Sciences Hamburg,Challenges in the Production of a Mixed Reality Theater Dance Performance,"Virtual and augmented reality systems are becoming more and more popular in artistic performances. Most of these experiences are based on 360-videos or single-user applications. We produced a mixed reality theater dance performance. An audience of 30 people wore XR-headsets during a theater show. The headsets were networked and shared the same tracking space. Three performers (singer, musician, dancer) performed live and their performance was motion captured and transferred in real-time into the virtual environment. In this poster, we report our technical setup and discuss the challenges that this entails."
P1310,John Dallas Cast: Johns Hopkins University; Alejandro Martin-Gomez: Johns Hopkins University; Mathias Unberath: Johns Hopkins University,Evaluation of Augmented Reality for Collaborative Environments,"We present ClimbAR, an open-source, collaborative, real-time, augmented reality application running natively on the Hololens 2 that allows climbers to virtually and collaboratively set climbing holds in their physical environments to better understand and plan their routes. We present the qualitative results of demonstrating ClimbAR at two climbing gyms as well as the quantitative results of analyzing the spatial alignment accuracy of its core synchronization framework, SynchronizAR, through a proto-user study. We find an average rotational alignment error of 12.83 degrees and an average translational alignment error of 3.85 centimeters when using SynchronizAR for collaborative layout tasks involving two users."
P1142,Qianyu Guo: Purdue University; Jiaming Fu: Purdue University; Yawen Lu: Purdue Univ; Dongming Gan: Polytechnic Institute ,Diffusion Attack: Leveraging Stable Diffusion for Naturalistic Image Attacking,"In Virtual Reality (VR), adversarial attack remains a significant security threat. Most deep learning-based methods for physical and digital adversarial attacks focus on enhancing attack performance by crafting adversarial examples that contain large printable distortions that are easy for human observers to identify. However, attackers rarely impose limitations on the naturalness and comfort of the appearance of the generated attack image, resulting in a noticeable and unnatural attack. To address this challenge, we propose a framework to incorporate style transfer to craft adversarial inputs of natural styles that exhibit minimal detectability and maximum natural appearance, while maintaining superior attack capabilities."
P1344,Xiaoyuan Wang: IRISA; Yang Li: East China Normal University; Changbo Wang: Depart of Software Science and Technology; Marc Christie: IRISA,Plausible and Diverse Human Hand Grasping Motion Generation,"Techniques to grasp targeted objects in realistic and diverse ways find many applications in computer graphics, robotics and VR. This study generates diverse grasping motions while keeping plausible final grasps for human hands. We first build on a Transformer-based VAE to encode diverse reaching motions into a latent representation noted as GMF and then train an MLP-based cVAE to learn the grasping affordance of targeted objects. Finally, through learning a denoising process, we condition GMF with affordance to generate grasping motions for the targeted object. We identify improvements in our results, and will further address them in future work."
P1212,Mathieu Lutfallah: ETH Zurich; Juyi Zhang: ETH Zurich; Andreas Kunz: ETH Zurich,DVIO - Distributed Visual Inertial Odometry in a Multi-user Environment,"Head-mounted displays typically use a visual inertial odometry system, which relies on the headset's camera combined with Inertial Measurement Units. While effective, this setup fails if the camera is obstructed or if the environments lacks features. Traditional recalibration methods like place recognition often fall short in such settings. Addressing this, the paper proposes a novel distributed tracking method that uses the positions of other users. This approach creates a network or ""daisy chain"" of user locations, enhancing position tracking accuracy. It serves as an alternative and a supplementary solution to the standard system, ensuring precise location tracking for all users."
P1216,Anthony Steed: University College London,AccompliceVR: Lending Assistance to Immersed Users by Adding a Generic Collaborative Layer,"The current model of development for virtual reality applications is that a single application is responsible for construction of the complete immersive experience. If the application is collaborative that application must implement the functionality for sharing. We present VRAccomplice, and overlay application that add a collaboration layer to applications running on SteamVR. Using the Ubiq software, we can add avatars controlled by remote users as an overlay into any running app used by a local user. Remote users can see video of the local user. We demonstrate this in some common SteamVR games."
P1174,Julianna C Washington: Southern Methodist University; Prajakt Pande: Southern Methodist University; Praveen Ramasamy: Danish Technological Institute; Morten E. Moeller: University College Copenhagen; Biljana Mojsoska: Roskilde University,Enacting Molecular Interactions in VR: Preliminary relationships between visual navigation and learning outcomes,"Twenty-three undergraduates participated in a pre-post quasi-experimental single-group study involving an immersive VR simulation which allowed them to embody (i.e. become) a biomolecule and enact/experience its molecular interactions at a microscopic level using actions and gestures. Based on initial data analyses from this study, the present poster reports preliminary findings on the relationships between the participants' visual navigation, and conceptual as well as affective learning outcomes."
P1149,"Takenori Hara: Dai Nippon Printing Co., Ltd.",Autonomous avatar for customer service training VR system,"By immersing trainees in a virtual space and conducting customer service training with customer avatars, physical training facilities are no longer required and customer service training costs can be reduced. Furthermore, since there is no need for travel time to the training facility, trainees can easily participate in training even from remote locations. However, the production cost of customer avatars that behave according to training scenarios has become a new issue in social implementation. Therefore, we conducted a preliminary implementation experiment of a customer avatar that works autonomously by incorporating LLM and reported the findings and problems we encountered."