name,affiliation
"Zhang, Guofeng","State Key Lab of CAD&CG, Zhejiang University, Computer Science College, Hangzhou, China"
"Zhang, He","College of Information Sciences and Technology, Pennsylvania State University, State College, Pennsylvania, USA"
"Zhang, Jingbo","City University of Hong Kong, Computer Science Departement, Hong Kong, Hong Kong"
"Zhang, Lei","School of Information, University of Michigan, Ann Arbor, Michigan, USA"
"Zhang, Lei","School of Computer Science, Beijing Institute of Technology, Beijing, China"
"Zhang, Song-Hai","Tsinghua University, Beijing, China"
"Zhang, Yidan","Data Visualisation and Immersive Analytics Lab, Monash University, Melbourne, Australia"
"Zhang, Zixun","York University, York, United Kingdom"
"Zhao, Hantao","ETH, Chair of Cognitive Science, Zurich, Switzerland"
"Zhao, Jingbo","College of Information and Electrical Engineering, China Agricultural University, Beijing, China"
"Zheng, Yilei","Beihang University, Beijing, China"
"Zhou, Bin","Beihang University, Beijing, China"
"Zhou, Kanglei","School of Computer Science and Engineering, Beihang University, Beijing, China"
"Zhou, Kyrie Zhixuan","Information Sciences, University of Illinois at Urbana-Champaign, Champaign, Illinois, USA"
"Zhou, Tian",
"Zhou, Xiaoyan","Computer Science, Colorado State University, Fort Collins, Colorado, USA"
"Zhou, Yuqi","Department of Computer Science, Purdue University, West Lafayette, Indiana, USA"
"Zhu, Kening","School of Creative Media, City University of Hong Kong, HongKong, China"
"Zhu, Lifeng","Southeast University, Nanjing, Jiangsu, China"
"Zhu, Yongning","Tongji University, Shanghai, China"
"Zhu, Zhenyang","Department of Computer Science and Engineering, University of Yamanashi, Kofu, Yamanashi, Japan"
"Zibrek, Katja","INRIA, Rennes, France"
"Zilles Borba, Eduardo","Communication Department (DECOM), Federal University of Rio Grande do Sul (UFRGS), Porto Alegre, RS, Brazil"
"Zollmann, Stefanie","Computer Science, University of Otago, Dunedin, New Zealand"